{
  "operation": "sdk_evidence@1",
  "version": 1,
  "planHash": "aaaaaaaaaaaaaaaaaaaaaaaaaaaaaaaaaaaaaaaaaaaaaaaaaaaaaaaaaaaaaaaa",
  "manifestHash": "aaaaaaaaaaaaaaaaaaaaaaaaaaaaaaaaaaaaaaaaaaaaaaaaaaaaaaaaaaaaaaaa",
  "intentHash": "aaaaaaaaaaaaaaaaaaaaaaaaaaaaaaaaaaaaaaaaaaaaaaaaaaaaaaaaaaaaaaaa",
  "modelHash": "aaaaaaaaaaaaaaaaaaaaaaaaaaaaaaaaaaaaaaaaaaaaaaaaaaaaaaaaaaaaaaaa",
  "metadataExact": true,
  "boneMapExact": true,
  "maxBindPositionError": 0,
  "maxBindRotationErrorDegrees": 0,
  "geometryReportHash": "aaaaaaaaaaaaaaaaaaaaaaaaaaaaaaaaaaaaaaaaaaaaaaaaaaaaaaaaaaaaaaaa",
  "files": {
    "geometry.json": "aaaaaaaaaaaaaaaaaaaaaaaaaaaaaaaaaaaaaaaaaaaaaaaaaaaaaaaaaaaaaaaa"
  },
  "limitations": [
    "single_lod",
    "sdk_regenerated_blocks",
    "native_frames_unverified",
    "source_export_fidelity_unverified"
  ],
  "runtimeTested": false,
  "productionAdmission": false
}
